Model,Jenis Ringkasan,Output
gp,a,"Seorang teman (Speaker 1) meminta rekomendasi makanan kepada temannya (Speaker 2) karena lapar dengan anggaran terbatas di akhir bulan; Beberapa pilihan makanan yang direkomendasikan adalah nasi warteg, nasi telur krispi, ayam geprek, dan mie instan di burjo; Speaker 2 juga menyarankan minuman sachet sebagai alternatif minuman hemat; Rekomendasi diberikan sebagai solusi yang murah, mengenyangkan, dan efisien; Speaker 1 akhirnya memutuskan untuk mencari dan membeli nasi telur krispi."
gp,b,"Percakapan ini mengisahkan seseorang yang kebingungan mencari makanan murah dan mengenyangkan saat kehabisan uang di akhir bulan. Temannya memberikan beberapa rekomendasi praktis seperti nasi warteg, nasi telur krispi, hingga minuman sachet yang lebih hemat. Setelah berdiskusi, penanya berterima kasih dan memutuskan untuk membeli nasi telur krispi sesuai saran yang diberikan."
cgpt,a,"Speaker 1 merasa lapar di akhir bulan dengan uang terbatas; Speaker 2 merekomendasikan makan murah di warteg dengan nasi tambah dan lauk variatif; Speaker 1 ingin alternatif selain warteg; Speaker 2 menyarankan nasi telur krispi, ayam geprek promo mahasiswa, atau mie instan di burjo; Untuk minuman, Speaker 2 menyarankan beli sachet di warung dengan es batu agar lebih hemat."
cgpt,b,"Percakapan ini membahas pilihan makanan murah untuk mahasiswa di akhir bulan. Warteg menjadi pilihan utama, tapi alternatif lain adalah nasi telur krispi, ayam geprek dengan promo mahasiswa, atau mie instan di burjo. Untuk minuman hemat, disarankan membeli sachet di warung dengan tambahan es batu. Akhirnya, Speaker 1 memilih nasi telur krispi sebagai opsi praktis dan murah."
qw,a,"Speaker 1 merasa lapar dan kehabisan uang di akhir bulan; Speaker 2 menyarankan nasi warteg, nasi telur krispi atau ayam geprek dengan promo mahasiswa di bawah Rp20.000, mie instan plus telur dan sayur di burjo, serta minuman sachet dengan es batu seharga sekitar Rp3.000; Saran diberikan karena keduanya membahas solusi makan murah dan mengenyangkan untuk mahasiswa; Percakapan terjadi secara informal antara dua orang yang mencari opsi makan hemat; Speaker 1 akhirnya memutuskan mencari nasi telur krispi setelah mendapat rekomendasi."
qw,b,"Seorang mahasiswa yang kelaparan dan kehabisan uang di akhir bulan meminta saran makanan murah. Temannya menyarankan beberapa pilihan hemat seperti nasi warteg, ayam geprek atau nasi telur krispi dengan promo mahasiswa, mie instan di burjo, serta minuman sachet dengan es batu. Saran tersebut dianggap praktis dan ekonomis, dan akhirnya si penanya memutuskan mencari nasi telur krispi."
ds,a,"Speaker 1 lapar dengan budget terbatas di akhir bulan dan meminta rekomendasi makanan murah dan mengenyangkan; Speaker 2 merekomendasikan nasi warteg dengan pilihan lauk banyak dan nasi bisa ditambah; Speaker 2 juga menyarankan warung nasi telur krispi/ayam geprek dengan promo mahasiswa di bawah Rp 20.000; Alternatif lain adalah mie instan plus telur dan sayur di warung burjo yang murah dan buka 24 jam; Untuk minuman, disarankan membeli minuman sachet dan meminta es batu agar lebih hemat."
ds,b,"Percakapan ini berisi seorang yang meminta rekomendasi makanan murah dan mengenyangkan karena budget-nya terbatas di akhir bulan. Rekomendasi yang diberikan antara lain nasi warteg, paket nasi telur krispi/ayam geprek, serta mie instan di warung burjo. Pembicaraan juga mencakup saran untuk berhemat pada minuman dengan membeli minuman sachet dan es batu."